{
  "schemaVersion": 1,
  "taskId": "GB-I1",
  "evaluatedAt": "2026-08-06T01:00:00.000Z",
  "success": false,
  "qualityScore": 90,
  "maxScore": 100,
  "components": {
    "hiddenEvaluation": 60,
    "publicRegression": 20,
    "changeScope": 10,
    "forbiddenChanges": 0
  },
  "changedFiles": ["src/customer.ts", "prisma/schema.prisma"],
  "forbiddenFiles": ["prisma/schema.prisma"],
  "failures": ["forbidden path changed: prisma/schema.prisma"]
}
